{
  "metadata": {
    "id": "twin-hvac-building-001",
    "name": "Smart Office Building - HVAC Digital Twin",
    "version": "1.0.0",
    "lastUpdated": "2026-06-03T06:49:32.399Z",
    "simulationTime": "2026-06-03T06:49:32.399Z",
    "timeStep": 60
  },
  "assets": [
    {
      "id": "building-001",
      "type": "building",
      "name": "Smart Office Building",
      "description": "3-floor office building with central HVAC",
      "properties": {
        "address": "123 Innovation Way",
        "grossArea": 45000,
        "areaUnit": "sqft",
        "yearBuilt": 2020,
        "floors": 3
      },
      "meshId": "Building_Shell",
      "status": "normal",
      "enabled": true
    },
    {
      "id": "floor-001",
      "type": "floor",
      "name": "Floor 1 - Lobby & Mechanical",
      "parentId": "building-001",
      "properties": {
        "level": 1,
        "area": 15000,
        "height": 12
      },
      "meshId": "Floor_1",
      "status": "normal"
    },
    {
      "id": "floor-002",
      "type": "floor",
      "name": "Floor 2 - Open Office",
      "parentId": "building-001",
      "properties": {
        "level": 2,
        "area": 15000,
        "height": 10
      },
      "meshId": "Floor_2",
      "status": "normal"
    },
    {
      "id": "floor-003",
      "type": "floor",
      "name": "Floor 3 - Executive",
      "parentId": "building-001",
      "properties": {
        "level": 3,
        "area": 15000,
        "height": 10
      },
      "meshId": "Floor_3",
      "status": "normal"
    },
    {
      "id": "zone-lobby-001",
      "type": "zone",
      "name": "Main Lobby",
      "parentId": "floor-001",
      "properties": {
        "area": 3000,
        "volume": 36000,
        "occupancyCapacity": 50,
        "currentOccupancy": 12,
        "zoneType": "lobby",
        "thermalMass": 5000,
        "thermalResistance": 0.15
      },
      "meshId": "Zone_Lobby",
      "pose": {
        "position": {
          "x": 0,
          "y": 0,
          "z": 0
        }
      },
      "thresholds": {
        "lowWarning": 68,
        "lowAlarm": 65,
        "highWarning": 76,
        "highAlarm": 80
      },
      "status": "normal"
    },
    {
      "id": "zone-mech-001",
      "type": "zone",
      "name": "Mechanical Room",
      "parentId": "floor-001",
      "properties": {
        "area": 2000,
        "volume": 24000,
        "occupancyCapacity": 5,
        "currentOccupancy": 0,
        "zoneType": "mechanical",
        "thermalMass": 3000,
        "thermalResistance": 0.1
      },
      "meshId": "Zone_Mechanical",
      "pose": {
        "position": {
          "x": 30,
          "y": 0,
          "z": 0
        }
      },
      "status": "normal"
    },
    {
      "id": "zone-office-001",
      "type": "zone",
      "name": "Open Office - Floor 2",
      "parentId": "floor-002",
      "properties": {
        "area": 10000,
        "volume": 100000,
        "occupancyCapacity": 120,
        "currentOccupancy": 65,
        "zoneType": "openOffice",
        "thermalMass": 12000,
        "thermalResistance": 0.12
      },
      "meshId": "Zone_Office_F2",
      "pose": {
        "position": {
          "x": 0,
          "y": 12,
          "z": 0
        }
      },
      "thresholds": {
        "lowWarning": 70,
        "lowAlarm": 68,
        "highWarning": 75,
        "highAlarm": 78
      },
      "status": "normal"
    },
    {
      "id": "zone-meeting-001",
      "type": "zone",
      "name": "Conference Room A",
      "parentId": "floor-002",
      "properties": {
        "area": 400,
        "volume": 4000,
        "occupancyCapacity": 12,
        "currentOccupancy": 0,
        "zoneType": "meetingRoom",
        "thermalMass": 800,
        "thermalResistance": 0.18
      },
      "meshId": "Zone_Meeting_A",
      "pose": {
        "position": {
          "x": 40,
          "y": 12,
          "z": 0
        }
      },
      "thresholds": {
        "lowWarning": 70,
        "lowAlarm": 68,
        "highWarning": 75,
        "highAlarm": 78
      },
      "status": "normal"
    },
    {
      "id": "zone-meeting-002",
      "type": "zone",
      "name": "Conference Room B",
      "parentId": "floor-002",
      "properties": {
        "area": 400,
        "volume": 4000,
        "occupancyCapacity": 12,
        "currentOccupancy": 8,
        "zoneType": "meetingRoom",
        "thermalMass": 800,
        "thermalResistance": 0.18
      },
      "meshId": "Zone_Meeting_B",
      "pose": {
        "position": {
          "x": 40,
          "y": 12,
          "z": 15
        }
      },
      "thresholds": {
        "lowWarning": 70,
        "lowAlarm": 68,
        "highWarning": 75,
        "highAlarm": 78
      },
      "status": "normal"
    },
    {
      "id": "zone-office-002",
      "type": "zone",
      "name": "Open Office - Floor 3",
      "parentId": "floor-003",
      "properties": {
        "area": 8000,
        "volume": 80000,
        "occupancyCapacity": 80,
        "currentOccupancy": 42,
        "zoneType": "openOffice",
        "thermalMass": 10000,
        "thermalResistance": 0.12
      },
      "meshId": "Zone_Office_F3",
      "pose": {
        "position": {
          "x": 0,
          "y": 22,
          "z": 0
        }
      },
      "thresholds": {
        "lowWarning": 70,
        "lowAlarm": 68,
        "highWarning": 75,
        "highAlarm": 78
      },
      "status": "normal"
    },
    {
      "id": "zone-exec-001",
      "type": "zone",
      "name": "Executive Suite",
      "parentId": "floor-003",
      "properties": {
        "area": 2000,
        "volume": 20000,
        "occupancyCapacity": 15,
        "currentOccupancy": 5,
        "zoneType": "executive",
        "thermalMass": 3000,
        "thermalResistance": 0.15
      },
      "meshId": "Zone_Executive",
      "pose": {
        "position": {
          "x": 35,
          "y": 22,
          "z": 0
        }
      },
      "thresholds": {
        "lowWarning": 70,
        "lowAlarm": 68,
        "highWarning": 74,
        "highAlarm": 76
      },
      "status": "normal"
    },
    {
      "id": "ahu-001",
      "type": "ahu",
      "name": "AHU-1 (Floors 1-2)",
      "parentId": "zone-mech-001",
      "properties": {
        "designCfm": 25000,
        "designStaticPressure": 2.5,
        "fanMotorHp": 30,
        "coolingCoilCapacity": 600000,
        "heatingCoilCapacity": 400000,
        "filterType": "MERV-13",
        "economizer": true,
        "heatRecovery": false
      },
      "meshId": "AHU_001",
      "pose": {
        "position": {
          "x": 32,
          "y": 2,
          "z": 5
        }
      },
      "status": "normal"
    },
    {
      "id": "ahu-002",
      "type": "ahu",
      "name": "AHU-2 (Floor 3)",
      "parentId": "zone-mech-001",
      "properties": {
        "designCfm": 15000,
        "designStaticPressure": 2,
        "fanMotorHp": 20,
        "coolingCoilCapacity": 360000,
        "heatingCoilCapacity": 240000,
        "filterType": "MERV-13",
        "economizer": true,
        "heatRecovery": false
      },
      "meshId": "AHU_002",
      "pose": {
        "position": {
          "x": 32,
          "y": 2,
          "z": 15
        }
      },
      "status": "normal"
    },
    {
      "id": "vav-001-01",
      "type": "vav",
      "name": "VAV-1-01 (Lobby)",
      "parentId": "zone-lobby-001",
      "properties": {
        "minCfm": 500,
        "maxCfm": 2500,
        "reheatCapacity": 50000
      },
      "meshId": "VAV_001_01",
      "status": "normal"
    },
    {
      "id": "vav-002-01",
      "type": "vav",
      "name": "VAV-2-01 (Office F2)",
      "parentId": "zone-office-001",
      "properties": {
        "minCfm": 2000,
        "maxCfm": 8000,
        "reheatCapacity": 100000
      },
      "meshId": "VAV_002_01",
      "status": "normal"
    },
    {
      "id": "vav-002-02",
      "type": "vav",
      "name": "VAV-2-02 (Meeting A)",
      "parentId": "zone-meeting-001",
      "properties": {
        "minCfm": 100,
        "maxCfm": 600,
        "reheatCapacity": 15000
      },
      "meshId": "VAV_002_02",
      "status": "normal"
    },
    {
      "id": "vav-002-03",
      "type": "vav",
      "name": "VAV-2-03 (Meeting B)",
      "parentId": "zone-meeting-002",
      "properties": {
        "minCfm": 100,
        "maxCfm": 600,
        "reheatCapacity": 15000
      },
      "meshId": "VAV_002_03",
      "status": "normal"
    },
    {
      "id": "vav-003-01",
      "type": "vav",
      "name": "VAV-3-01 (Office F3)",
      "parentId": "zone-office-002",
      "properties": {
        "minCfm": 1500,
        "maxCfm": 6000,
        "reheatCapacity": 80000
      },
      "meshId": "VAV_003_01",
      "status": "normal"
    },
    {
      "id": "vav-003-02",
      "type": "vav",
      "name": "VAV-3-02 (Executive)",
      "parentId": "zone-exec-001",
      "properties": {
        "minCfm": 400,
        "maxCfm": 2000,
        "reheatCapacity": 40000
      },
      "meshId": "VAV_003_02",
      "status": "normal"
    },
    {
      "id": "chiller-001",
      "type": "chiller",
      "name": "Chiller-1 (200 Ton)",
      "parentId": "zone-mech-001",
      "properties": {
        "capacityTons": 200,
        "designCop": 5.5,
        "minLoad": 0.2,
        "maxLoad": 1,
        "chwSupplyTempDesign": 44,
        "chwReturnTempDesign": 54
      },
      "meshId": "Chiller_001",
      "pose": {
        "position": {
          "x": 35,
          "y": 0,
          "z": 10
        }
      },
      "status": "normal"
    },
    {
      "id": "boiler-001",
      "type": "boiler",
      "name": "Boiler-1 (2M BTU)",
      "parentId": "zone-mech-001",
      "properties": {
        "capacityBtu": 2000000,
        "designEfficiency": 0.92,
        "minLoad": 0.1,
        "hwSupplyTempDesign": 180,
        "hwReturnTempDesign": 160
      },
      "meshId": "Boiler_001",
      "pose": {
        "position": {
          "x": 38,
          "y": 0,